{
  "schema_version": "sys4ai.plan-normalization-report.v1",
  "report_id": "PNR-EXAMPLE-001",
  "plan_id": "PLAN-EXAMPLE-001",
  "source_set_sha256": "1111111111111111111111111111111111111111111111111111111111111111",
  "normalization_contract_sha256": "2222222222222222222222222222222222222222222222222222222222222222",
  "sources": [
    {
      "source_id": "SOURCE-001",
      "source_sha256": "3333333333333333333333333333333333333333333333333333333333333333",
      "media_type": "application/json",
      "source_class": "structured_plan",
      "authority": "accepted",
      "precedence": 0,
      "immutable_ref": "examples/source-plan.json",
      "classification_evidence": [
        "Explicit ordered phases, tasks, dependencies, and acceptance boundaries are present."
      ]
    }
  ],
  "candidate_plan_sha256": null,
  "status": "blocked",
  "findings": [
    {
      "code": "fixture.blocked",
      "severity": "blocking",
      "message": "Synthetic normalization outcome: blocked.",
      "source_ids": [
        "SOURCE-001"
      ]
    }
  ],
  "traceability": [
    {
      "output_kind": "task",
      "output_id": "TASK-001",
      "source_anchors": [
        "SOURCE-001#/tasks/0"
      ],
      "transformation": "canonicalized",
      "generated": false
    }
  ],
  "task_sizing": [
    {
      "task_id": "TASK-001",
      "result": "ready",
      "evidence_refs": [
        "evidence/task-001-sizing.md"
      ],
      "replacement_task_ids": []
    }
  ],
  "canonicalization_only": false,
  "hash_basis": "canonical_json_without_report_content_sha256",
  "report_content_sha256": "c045997ed0bac6f70c7e68cf4ee73ecf6b143ac2ff12c6056d7f86cb7c1d5573",
  "finalized": true,
  "extensions": {}
}
